{
  "schema_version": "0.1",
  "record_type": "probe_delivery",
  "probe_id": "test-prop-probe-20260904-01",
  "asset_id": "test-prop",
  "state": "received",
  "probe_plan": {
    "path": "astrion-3d-pipeline/work/generative-probes/test-prop/test-prop-probe-20260904-01/probe-plan.json",
    "sha256": "9999999999999999999999999999999999999999999999999999999999999999"
  },
  "provider": "meshy",
  "request_id": "meshy-primary",
  "candidate_id": "meshy-candidate-01",
  "provenance": {
    "delivery_mode": "manual",
    "external_job_id": null,
    "model": "unknown",
    "generation_mode": "image_to_3d",
    "settings": {
      "topology": "provider-default"
    },
    "seed": null,
    "generated_at": null,
    "license": "unknown"
  },
  "files": [
    {
      "path": "astrion-3d-pipeline/work/generative-probes/test-prop/test-prop-probe-20260904-01/intake/meshy/meshy-candidate-01/model.glb",
      "role": "model",
      "media_type": "model/gltf-binary",
      "sha256": "aaaaaaaaaaaaaaaaaaaaaaaaaaaaaaaaaaaaaaaaaaaaaaaaaaaaaaaaaaaaaaaa",
      "size_bytes": 123456
    }
  ],
  "delivered_at": "2026-09-04T18:00:00-06:00",
  "delivered_by": "repository owner"
}
